{
  "$schema": "https://json-schema.org/draft/2020-12/schema",
  "$id": "https://github.com/PlasmaStorm49/musicle-jp/shared/schema/anime-mixed.schema.json",
  "title": "Agenda das Misturadas do musicle-jp",
  "description": "Os 2 diários de cada dia das Misturadas (M17): acertar a música e acertar o anime, de 4 rodadas cada, com 2, 2, 2 e 3 músicas tocando juntas (P325). Usa o catálogo do Anime. Só cresce: um dia gravado nunca muda. Gerado só pelo pipeline (comando schedule-mixed).",
  "type": "object",
  "additionalProperties": false,
  "required": ["schemaVersion", "kind", "timezone", "epoch", "days"],
  "properties": {
    "schemaVersion": { "const": 1 },
    "kind": {
      "description": "Distingue a agenda das Misturadas das outras (o schedule-check despacha pelo tipo).",
      "const": "anime-mixed"
    },
    "timezone": { "const": "America/Sao_Paulo" },
    "epoch": { "$ref": "#/$defs/date" },
    "days": {
      "type": "object",
      "propertyNames": { "$ref": "#/$defs/date" },
      "additionalProperties": { "$ref": "#/$defs/day" }
    }
  },
  "$defs": {
    "date": { "type": "string", "pattern": "^\\d{4}-\\d{2}-\\d{2}$" },
    "trackId": { "type": "string", "pattern": "^[a-z]+:tr:[A-Za-z0-9_-]+$" },
    "round": {
      "title": "Rodada das Misturadas do musicle-jp",
      "description": "As faixas que tocam juntas, de franquias diferentes. No acertar o anime, cada resposta é a franquia da faixa (P234).",
      "type": "object",
      "additionalProperties": false,
      "required": ["answers"],
      "properties": {
        "answers": {
          "type": "array",
          "minItems": 2,
          "maxItems": 3,
          "uniqueItems": true,
          "items": { "$ref": "#/$defs/trackId" }
        }
      }
    },
    "rounds": {
      "title": "Rodadas de um diário das Misturadas do musicle-jp",
      "description": "As 4 rodadas: 2, 2, 2 e 3 músicas (o pipeline confere a conta).",
      "type": "array",
      "minItems": 4,
      "maxItems": 4,
      "items": { "$ref": "#/$defs/round" }
    },
    "day": {
      "title": "Dia da agenda das Misturadas do musicle-jp",
      "description": "O diário do modo musica (acertar a música) e o do modo titulo (acertar o anime).",
      "type": "object",
      "additionalProperties": false,
      "required": ["number", "catalogVersion", "musica", "titulo"],
      "properties": {
        "number": { "type": "integer", "minimum": 1 },
        "catalogVersion": { "type": "string", "pattern": "^\\d{4}-\\d{2}-\\d{2}\\.[0-9a-f]{8}$" },
        "musica": { "$ref": "#/$defs/rounds" },
        "titulo": { "$ref": "#/$defs/rounds" }
      }
    }
  }
}
