{
  "days": {
    "2026-10-08": {
      "catalogVersion": "2026-10-05.14d16bca",
      "musica": [
        {
          "answers": [
            "fixture:tr:tr21",
            "fixture:tr:tr33"
          ]
        },
        {
          "answers": [
            "fixture:tr:tr22",
            "fixture:tr:tr34"
          ]
        },
        {
          "answers": [
            "fixture:tr:tr36",
            "fixture:tr:tr09"
          ]
        },
        {
          "answers": [
            "fixture:tr:tr24",
            "fixture:tr:tr26",
            "fixture:tr:tr31"
          ]
        }
      ],
      "number": 1,
      "titulo": [
        {
          "answers": [
            "fixture:tr:tr41",
            "fixture:tr:tr19"
          ]
        },
        {
          "answers": [
            "fixture:tr:tr35",
            "fixture:tr:tr07"
          ]
        },
        {
          "answers": [
            "fixture:tr:tr08",
            "fixture:tr:tr39"
          ]
        },
        {
          "answers": [
            "fixture:tr:tr15",
            "fixture:tr:tr01",
            "fixture:tr:tr38"
          ]
        }
      ]
    },
    "2026-10-09": {
      "catalogVersion": "2026-10-05.14d16bca",
      "musica": [
        {
          "answers": [
            "fixture:tr:tr42",
            "fixture:tr:tr24"
          ]
        },
        {
          "answers": [
            "fixture:tr:tr20",
            "fixture:tr:tr27"
          ]
        },
        {
          "answers": [
            "fixture:tr:tr32",
            "fixture:tr:tr18"
          ]
        },
        {
          "answers": [
            "fixture:tr:tr34",
            "fixture:tr:tr38",
            "fixture:tr:tr16"
          ]
        }
      ],
      "number": 2,
      "titulo": [
        {
          "answers": [
            "fixture:tr:tr40",
            "fixture:tr:tr05"
          ]
        },
        {
          "answers": [
            "fixture:tr:tr17",
            "fixture:tr:tr37"
          ]
        },
        {
          "answers": [
            "fixture:tr:tr25",
            "fixture:tr:tr29"
          ]
        },
        {
          "answers": [
            "fixture:tr:tr35",
            "fixture:tr:tr01",
            "fixture:tr:tr23"
          ]
        }
      ]
    },
    "2026-10-10": {
      "catalogVersion": "2026-10-05.14d16bca",
      "musica": [
        {
          "answers": [
            "fixture:tr:tr33",
            "fixture:tr:tr27"
          ]
        },
        {
          "answers": [
            "fixture:tr:tr22",
            "fixture:tr:tr24"
          ]
        },
        {
          "answers": [
            "fixture:tr:tr09",
            "fixture:tr:tr31"
          ]
        },
        {
          "answers": [
            "fixture:tr:tr01",
            "fixture:tr:tr30",
            "fixture:tr:tr07"
          ]
        }
      ],
      "number": 3,
      "titulo": [
        {
          "answers": [
            "fixture:tr:tr41",
            "fixture:tr:tr08"
          ]
        },
        {
          "answers": [
            "fixture:tr:tr19",
            "fixture:tr:tr39"
          ]
        },
        {
          "answers": [
            "fixture:tr:tr36",
            "fixture:tr:tr26"
          ]
        },
        {
          "answers": [
            "fixture:tr:tr18",
            "fixture:tr:tr21",
            "fixture:tr:tr38"
          ]
        }
      ]
    },
    "2026-10-11": {
      "catalogVersion": "2026-10-05.14d16bca",
      "musica": [
        {
          "answers": [
            "fixture:tr:tr06",
            "fixture:tr:tr10"
          ]
        },
        {
          "answers": [
            "fixture:tr:tr34",
            "fixture:tr:tr38"
          ]
        },
        {
          "answers": [
            "fixture:tr:tr15",
            "fixture:tr:tr37"
          ]
        },
        {
          "answers": [
            "fixture:tr:tr17",
            "fixture:tr:tr16",
            "fixture:tr:tr35"
          ]
        }
      ],
      "number": 4,
      "titulo": [
        {
          "answers": [
            "fixture:tr:tr41",
            "fixture:tr:tr25"
          ]
        },
        {
          "answers": [
            "fixture:tr:tr05",
            "fixture:tr:tr09"
          ]
        },
        {
          "answers": [
            "fixture:tr:tr29",
            "fixture:tr:tr18"
          ]
        },
        {
          "answers": [
            "fixture:tr:tr26",
            "fixture:tr:tr33",
            "fixture:tr:tr22"
          ]
        }
      ]
    },
    "2026-10-12": {
      "catalogVersion": "2026-10-05.14d16bca",
      "musica": [
        {
          "answers": [
            "fixture:tr:tr42",
            "fixture:tr:tr23"
          ]
        },
        {
          "answers": [
            "fixture:tr:tr24",
            "fixture:tr:tr27"
          ]
        },
        {
          "answers": [
            "fixture:tr:tr07",
            "fixture:tr:tr39"
          ]
        },
        {
          "answers": [
            "fixture:tr:tr34",
            "fixture:tr:tr33",
            "fixture:tr:tr38"
          ]
        }
      ],
      "number": 5,
      "titulo": [
        {
          "answers": [
            "fixture:tr:tr32",
            "fixture:tr:tr19"
          ]
        },
        {
          "answers": [
            "fixture:tr:tr31",
            "fixture:tr:tr40"
          ]
        },
        {
          "answers": [
            "fixture:tr:tr36",
            "fixture:tr:tr37"
          ]
        },
        {
          "answers": [
            "fixture:tr:tr25",
            "fixture:tr:tr22",
            "fixture:tr:tr20"
          ]
        }
      ]
    },
    "2026-10-13": {
      "catalogVersion": "2026-10-05.14d16bca",
      "musica": [
        {
          "answers": [
            "fixture:tr:tr42",
            "fixture:tr:tr01"
          ]
        },
        {
          "answers": [
            "fixture:tr:tr34",
            "fixture:tr:tr27"
          ]
        },
        {
          "answers": [
            "fixture:tr:tr05",
            "fixture:tr:tr17"
          ]
        },
        {
          "answers": [
            "fixture:tr:tr09",
            "fixture:tr:tr41",
            "fixture:tr:tr35"
          ]
        }
      ],
      "number": 6,
      "titulo": [
        {
          "answers": [
            "fixture:tr:tr16",
            "fixture:tr:tr08"
          ]
        },
        {
          "answers": [
            "fixture:tr:tr15",
            "fixture:tr:tr18"
          ]
        },
        {
          "answers": [
            "fixture:tr:tr39",
            "fixture:tr:tr30"
          ]
        },
        {
          "answers": [
            "fixture:tr:tr32",
            "fixture:tr:tr07",
            "fixture:tr:tr06"
          ]
        }
      ]
    },
    "2026-10-14": {
      "catalogVersion": "2026-10-05.14d16bca",
      "musica": [
        {
          "answers": [
            "fixture:tr:tr38",
            "fixture:tr:tr20"
          ]
        },
        {
          "answers": [
            "fixture:tr:tr33",
            "fixture:tr:tr24"
          ]
        },
        {
          "answers": [
            "fixture:tr:tr19",
            "fixture:tr:tr26"
          ]
        },
        {
          "answers": [
            "fixture:tr:tr23",
            "fixture:tr:tr27",
            "fixture:tr:tr40"
          ]
        }
      ],
      "number": 7,
      "titulo": [
        {
          "answers": [
            "fixture:tr:tr41",
            "fixture:tr:tr37"
          ]
        },
        {
          "answers": [
            "fixture:tr:tr36",
            "fixture:tr:tr07"
          ]
        },
        {
          "answers": [
            "fixture:tr:tr31",
            "fixture:tr:tr09"
          ]
        },
        {
          "answers": [
            "fixture:tr:tr18",
            "fixture:tr:tr22",
            "fixture:tr:tr05"
          ]
        }
      ]
    },
    "2026-10-15": {
      "catalogVersion": "2026-10-05.14d16bca",
      "musica": [
        {
          "answers": [
            "fixture:tr:tr20",
            "fixture:tr:tr22"
          ]
        },
        {
          "answers": [
            "fixture:tr:tr34",
            "fixture:tr:tr27"
          ]
        },
        {
          "answers": [
            "fixture:tr:tr35",
            "fixture:tr:tr32"
          ]
        },
        {
          "answers": [
            "fixture:tr:tr16",
            "fixture:tr:tr08",
            "fixture:tr:tr25"
          ]
        }
      ],
      "number": 8,
      "titulo": [
        {
          "answers": [
            "fixture:tr:tr41",
            "fixture:tr:tr29"
          ]
        },
        {
          "answers": [
            "fixture:tr:tr05",
            "fixture:tr:tr39"
          ]
        },
        {
          "answers": [
            "fixture:tr:tr37",
            "fixture:tr:tr26"
          ]
        },
        {
          "answers": [
            "fixture:tr:tr18",
            "fixture:tr:tr21",
            "fixture:tr:tr10"
          ]
        }
      ]
    },
    "2026-10-16": {
      "catalogVersion": "2026-10-05.14d16bca",
      "musica": [
        {
          "answers": [
            "fixture:tr:tr38",
            "fixture:tr:tr01"
          ]
        },
        {
          "answers": [
            "fixture:tr:tr33",
            "fixture:tr:tr24"
          ]
        },
        {
          "answers": [
            "fixture:tr:tr36",
            "fixture:tr:tr09"
          ]
        },
        {
          "answers": [
            "fixture:tr:tr34",
            "fixture:tr:tr10",
            "fixture:tr:tr30"
          ]
        }
      ],
      "number": 9,
      "titulo": [
        {
          "answers": [
            "fixture:tr:tr41",
            "fixture:tr:tr07"
          ]
        },
        {
          "answers": [
            "fixture:tr:tr31",
            "fixture:tr:tr19"